{
  "event": "IEM Cologne 2025",
  "stage": "Grand Final (SAMPLE / synthetic data)",
  "date": "2025-08-10",
  "sourceUrl": "synthetic",
  "format": "bo3",
  "teams": {
    "a": {
      "name": "Team A",
      "color": "#e4b343"
    },
    "b": {
      "name": "Team B",
      "color": "#3a6ea5"
    }
  },
  "seriesScore": {
    "a": 2,
    "b": 1
  },
  "maps": [
    {
      "name": "Mirage",
      "score": {
        "a": 13,
        "b": 9
      },
      "winner": "a",
      "overtime": false,
      "decider": false,
      "rounds": [
        {
          "n": 1,
          "half": 1,
          "winner": "b",
          "side": {
            "a": "T",
            "b": "CT"
          },
          "winType": "bomb_defuse",
          "bombPlant": true,
          "kills": 10
        },
        {
          "n": 2,
          "half": 1,
          "winner": "a",
          "side": {
            "a": "T",
            "b": "CT"
          },
          "winType": "bomb_detonate",
          "bombPlant": true,
          "kills": 9
        },
        {
          "n": 3,
          "half": 1,
          "winner": "a",
          "side": {
            "a": "T",
            "b": "CT"
          },
          "winType": "bomb_defuse",
          "bombPlant": true,
          "kills": 3
        },
        {
          "n": 4,
          "half": 1,
          "winner": "b",
          "side": {
            "a": "T",
            "b": "CT"
          },
          "winType": "elimination",
          "bombPlant": false,
          "kills": 6
        },
        {
          "n": 5,
          "half": 1,
          "winner": "b",
          "side": {
            "a": "T",
            "b": "CT"
          },
          "winType": "time",
          "bombPlant": false,
          "kills": 4
        },
        {
          "n": 6,
          "half": 1,
          "winner": "b",
          "side": {
            "a": "T",
            "b": "CT"
          },
          "winType": "bomb_detonate",
          "bombPlant": true,
          "kills": 4
        },
        {
          "n": 7,
          "half": 1,
          "winner": "b",
          "side": {
            "a": "T",
            "b": "CT"
          },
          "winType": "bomb_detonate",
          "bombPlant": true,
          "kills": 8
        },
        {
          "n": 8,
          "half": 1,
          "winner": "b",
          "side": {
            "a": "T",
            "b": "CT"
          },
          "winType": "time",
          "bombPlant": true,
          "kills": 10
        },
        {
          "n": 9,
          "half": 1,
          "winner": "b",
          "side": {
            "a": "T",
            "b": "CT"
          },
          "winType": "bomb_detonate",
          "bombPlant": true,
          "kills": 10
        },
        {
          "n": 10,
          "half": 1,
          "winner": "b",
          "side": {
            "a": "T",
            "b": "CT"
          },
          "winType": "bomb_detonate",
          "bombPlant": true,
          "kills": 8
        },
        {
          "n": 11,
          "half": 1,
          "winner": "a",
          "side": {
            "a": "T",
            "b": "CT"
          },
          "winType": "bomb_defuse",
          "bombPlant": true,
          "kills": 4
        },
        {
          "n": 12,
          "half": 1,
          "winner": "b",
          "side": {
            "a": "T",
            "b": "CT"
          },
          "winType": "elimination",
          "bombPlant": false,
          "kills": 7
        },
        {
          "n": 13,
          "half": 2,
          "winner": "a",
          "side": {
            "a": "CT",
            "b": "T"
          },
          "winType": "bomb_detonate",
          "bombPlant": true,
          "kills": 4
        },
        {
          "n": 14,
          "half": 2,
          "winner": "a",
          "side": {
            "a": "CT",
            "b": "T"
          },
          "winType": "bomb_detonate",
          "bombPlant": true,
          "kills": 7
        },
        {
          "n": 15,
          "half": 2,
          "winner": "a",
          "side": {
            "a": "CT",
            "b": "T"
          },
          "winType": "bomb_defuse",
          "bombPlant": true,
          "kills": 6
        },
        {
          "n": 16,
          "half": 2,
          "winner": "a",
          "side": {
            "a": "CT",
            "b": "T"
          },
          "winType": "elimination",
          "bombPlant": true,
          "kills": 8
        },
        {
          "n": 17,
          "half": 2,
          "winner": "a",
          "side": {
            "a": "CT",
            "b": "T"
          },
          "winType": "bomb_detonate",
          "bombPlant": true,
          "kills": 5
        },
        {
          "n": 18,
          "half": 2,
          "winner": "a",
          "side": {
            "a": "CT",
            "b": "T"
          },
          "winType": "bomb_detonate",
          "bombPlant": true,
          "kills": 3
        },
        {
          "n": 19,
          "half": 2,
          "winner": "a",
          "side": {
            "a": "CT",
            "b": "T"
          },
          "winType": "bomb_defuse",
          "bombPlant": true,
          "kills": 9
        },
        {
          "n": 20,
          "half": 2,
          "winner": "a",
          "side": {
            "a": "CT",
            "b": "T"
          },
          "winType": "elimination",
          "bombPlant": false,
          "kills": 10
        },
        {
          "n": 21,
          "half": 2,
          "winner": "a",
          "side": {
            "a": "CT",
            "b": "T"
          },
          "winType": "bomb_detonate",
          "bombPlant": true,
          "kills": 5
        },
        {
          "n": 22,
          "half": 2,
          "winner": "a",
          "side": {
            "a": "CT",
            "b": "T"
          },
          "winType": "elimination",
          "bombPlant": false,
          "kills": 4
        }
      ],
      "players": [
        {
          "team": "a",
          "name": "A_p1",
          "kills": 19,
          "deaths": 24,
          "adr": 79.5,
          "rating": 1.26,
          "clutches": [
            {
              "round": 14,
              "vs": 2
            }
          ],
          "aces": []
        },
        {
          "team": "a",
          "name": "A_p2",
          "kills": 14,
          "deaths": 15,
          "adr": 64.5,
          "rating": 1.35,
          "clutches": [],
          "aces": []
        },
        {
          "team": "a",
          "name": "A_p3",
          "kills": 24,
          "deaths": 21,
          "adr": 108.9,
          "rating": 1.37,
          "clutches": [],
          "aces": []
        },
        {
          "team": "a",
          "name": "A_p4",
          "kills": 21,
          "deaths": 19,
          "adr": 60.5,
          "rating": 1.4,
          "clutches": [],
          "aces": []
        },
        {
          "team": "a",
          "name": "A_p5",
          "kills": 16,
          "deaths": 21,
          "adr": 68.3,
          "rating": 1,
          "clutches": [],
          "aces": []
        },
        {
          "team": "b",
          "name": "B_p1",
          "kills": 14,
          "deaths": 18,
          "adr": 73.4,
          "rating": 0.92,
          "clutches": [
            {
              "round": 14,
              "vs": 3
            }
          ],
          "aces": []
        },
        {
          "team": "b",
          "name": "B_p2",
          "kills": 24,
          "deaths": 24,
          "adr": 80.4,
          "rating": 1.13,
          "clutches": [],
          "aces": []
        },
        {
          "team": "b",
          "name": "B_p3",
          "kills": 18,
          "deaths": 20,
          "adr": 95.1,
          "rating": 1.4,
          "clutches": [],
          "aces": []
        },
        {
          "team": "b",
          "name": "B_p4",
          "kills": 24,
          "deaths": 15,
          "adr": 91.8,
          "rating": 1.28,
          "clutches": [],
          "aces": []
        },
        {
          "team": "b",
          "name": "B_p5",
          "kills": 13,
          "deaths": 22,
          "adr": 109.3,
          "rating": 0.98,
          "clutches": [],
          "aces": []
        }
      ]
    },
    {
      "name": "Inferno",
      "score": {
        "a": 11,
        "b": 13
      },
      "winner": "b",
      "overtime": false,
      "decider": false,
      "rounds": [
        {
          "n": 1,
          "half": 1,
          "winner": "a",
          "side": {
            "a": "T",
            "b": "CT"
          },
          "winType": "elimination",
          "bombPlant": true,
          "kills": 6
        },
        {
          "n": 2,
          "half": 1,
          "winner": "b",
          "side": {
            "a": "T",
            "b": "CT"
          },
          "winType": "elimination",
          "bombPlant": true,
          "kills": 7
        },
        {
          "n": 3,
          "half": 1,
          "winner": "b",
          "side": {
            "a": "T",
            "b": "CT"
          },
          "winType": "bomb_defuse",
          "bombPlant": true,
          "kills": 3
        },
        {
          "n": 4,
          "half": 1,
          "winner": "b",
          "side": {
            "a": "T",
            "b": "CT"
          },
          "winType": "bomb_detonate",
          "bombPlant": true,
          "kills": 5
        },
        {
          "n": 5,
          "half": 1,
          "winner": "b",
          "side": {
            "a": "T",
            "b": "CT"
          },
          "winType": "time",
          "bombPlant": false,
          "kills": 9
        },
        {
          "n": 6,
          "half": 1,
          "winner": "b",
          "side": {
            "a": "T",
            "b": "CT"
          },
          "winType": "bomb_defuse",
          "bombPlant": true,